{
  "schema": "htdt.capture.accuracy-benchmark-observations",
  "schema_version": "1.0.0",
  "benchmark_id": "30000000-0000-4000-8000-000000000001",
  "protocol_version": "1.0.0",
  "device_metadata": {
    "device_model_identifier": "synthetic-fixture",
    "os_version": "fixtureOS-1",
    "app_version": "0.0.0-fixture",
    "app_build": "accuracy-fixture",
    "capability_profile_ref": "fixture-capability",
    "ar_configuration_profile_hash": "aaaaaaaaaaaaaaaaaaaaaaaaaaaaaaaaaaaaaaaaaaaaaaaaaaaaaaaaaaaaaaaa"
  },
  "capture_protocol": {
    "trajectory": "closed_loop",
    "operator_id": "operator-a",
    "repeated_scan_count": 3,
    "room_scale": "small_room_fixture"
  },
  "reference_instrument": {
    "instrument_class": "laser_distance_meter",
    "make_model": "synthetic-reference",
    "calibration_status": "fixture",
    "calibration_date": "2026-09-01",
    "stated_uncertainty_m": 0.001
  },
  "dimension_observations": [
    {"quantity": "room_width", "scan_index": 1, "reference_m": 3.4, "observed_m": 3.401},
    {"quantity": "room_width", "scan_index": 2, "reference_m": 3.4, "observed_m": 3.397},
    {"quantity": "room_width", "scan_index": 3, "reference_m": 3.4, "observed_m": 3.404},
    {"quantity": "room_length", "scan_index": 1, "reference_m": 4.8, "observed_m": 4.81},
    {"quantity": "room_length", "scan_index": 2, "reference_m": 4.8, "observed_m": 4.795},
    {"quantity": "room_length", "scan_index": 3, "reference_m": 4.8, "observed_m": 4.805}
  ],
  "plane_residual_observations": [
    {"plane_id": "wall-a", "residuals_m": [0.005, -0.004, 0.006, -0.003]},
    {"plane_id": "floor", "residuals_m": [0.003, -0.002, 0.004, -0.003]}
  ],
  "roomplan_mesh_alignment_observations": [
    {"sample_id": "a", "roomplan_point_m": [0.0, 0.0, 0.0], "armesh_point_m": [0.008, -0.003, 0.002]},
    {"sample_id": "b", "roomplan_point_m": [3.4, 0.0, 0.0], "armesh_point_m": [3.391, 0.004, -0.003]},
    {"sample_id": "c", "roomplan_point_m": [0.0, 2.4, 0.0], "armesh_point_m": [0.005, 2.392, 0.004]}
  ],
  "loop_closure_observations": [
    {"scan_id": "scan-1", "start_position_m": [0.0, 0.0, 0.0], "end_position_m": [0.015, 0.0, 0.0]},
    {"scan_id": "scan-2", "start_position_m": [0.0, 0.0, 0.0], "end_position_m": [0.012, 0.012, 0.0]},
    {"scan_id": "scan-3", "start_position_m": [0.0, 0.0, 0.0], "end_position_m": [0.01, -0.014, 0.0]}
  ],
  "annotation_position_observations": [
    {"marker_id": "speaker-L", "scan_index": 1, "position_m": [0.5, 1.0, 0.8]},
    {"marker_id": "speaker-L", "scan_index": 2, "position_m": [0.507, 0.996, 0.802]},
    {"marker_id": "speaker-L", "scan_index": 3, "position_m": [0.496, 1.004, 0.799]},
    {"marker_id": "mlp", "scan_index": 1, "position_m": [1.7, 2.8, 1.0]},
    {"marker_id": "mlp", "scan_index": 2, "position_m": [1.706, 2.794, 1.002]},
    {"marker_id": "mlp", "scan_index": 3, "position_m": [1.695, 2.805, 0.998]}
  ],
  "speaker_orientation_observations": [
    {"speaker_id": "L", "scan_index": 1, "reference_front": [0.0, 0.0, -1.0], "observed_front": [0.0174524, 0.0, -0.9998477]},
    {"speaker_id": "L", "scan_index": 2, "reference_front": [0.0, 0.0, -1.0], "observed_front": [0.0261769, 0.0, -0.9996573]},
    {"speaker_id": "L", "scan_index": 3, "reference_front": [0.0, 0.0, -1.0], "observed_front": [0.0087265, 0.0, -0.9999619]}
  ],
  "depth_observations": [
    {"sample_id": "d01", "reference_distance_m": 0.5, "observed_depth_m": 0.505, "confidence": 2},
    {"sample_id": "d02", "reference_distance_m": 0.7, "observed_depth_m": 0.696, "confidence": 2},
    {"sample_id": "d03", "reference_distance_m": 0.9, "observed_depth_m": 0.906, "confidence": 1},
    {"sample_id": "d04", "reference_distance_m": 1.2, "observed_depth_m": 1.21, "confidence": 2},
    {"sample_id": "d05", "reference_distance_m": 1.5, "observed_depth_m": 1.492, "confidence": 1},
    {"sample_id": "d06", "reference_distance_m": 1.8, "observed_depth_m": 1.812, "confidence": 2},
    {"sample_id": "d07", "reference_distance_m": 2.2, "observed_depth_m": 2.22, "confidence": 2},
    {"sample_id": "d08", "reference_distance_m": 2.5, "observed_depth_m": 2.485, "confidence": 1},
    {"sample_id": "d09", "reference_distance_m": 2.8, "observed_depth_m": 2.825, "confidence": 1},
    {"sample_id": "d10", "reference_distance_m": 3.2, "observed_depth_m": 3.24, "confidence": 2},
    {"sample_id": "d11", "reference_distance_m": 4.0, "observed_depth_m": 3.97, "confidence": 1},
    {"sample_id": "d12", "reference_distance_m": 4.8, "observed_depth_m": 4.85, "confidence": 0}
  ]
}
